<?xml version="1.0" encoding="utf-8"?><!--/*********************************************************************************************************************** * Copyright (c) 2008 empolis GmbH and brox IT Solutions GmbH. All rights reserved. This program and the accompanying * materials are made available under the terms of the Eclipse Public License v1.0 which accompanies this distribution, * and is available at http://www.eclipse.org/legal/epl-v10.html * * Contributors: Georg Schmidt (brox IT Solutions GmbH) - initial creator **********************************************************************************************************************/--><ParameterDescriptions xmlns="http://www.anyfinder.de/ParameterDescriptions" xmlns:xsi="http://www.w3.org/2001/XMLSchema-instance" xsi:schemaLocation="http://www.anyfinder.de/ParameterDescriptions ParameterDescriptions.xsd">  <ParameterDescription Name="TextField">    <Attribute Name="Operator" Visible="true" />    <Attribute Name="CodecClass" Visible="false" />    <Attribute Name="Tolerance" Visible="true" />  </ParameterDescription>  <ParameterDescription Name="NumberField">    <Attribute Name="CodecClass" Visible="false" />  </ParameterDescription>  <ParameterDescription Name="DateField">    <Attribute Name="CodecClass" Visible="false" />  </ParameterDescription></ParameterDescriptions>